{
  "id": "a2b3c4d5-e6f7-4890-abcd-ef0123456789",
  "organization_id": "f1e2d3c4-b5a6-4978-9012-345678901234",
  "name": "Production Revocation Profile",
  "status": "ACTIVE",
  "revocation_mechanism": ["STATUS_LIST_2021", "OCSP"],
  "mechanism_priority": ["STATUS_LIST_2021", "OCSP"],
  "check_mode": "CACHED",
  "cache_ttl_seconds": 3600,
  "issuer_config": {
    "auto_allocate_index": true,
    "batch_update_interval_seconds": 300,
    "list_size": 131072
  },
  "status_list_url": "https://status.example.com/lists",
  "created_at": "2026-01-01T00:00:00Z",
  "updated_at": "2026-02-01T00:00:00Z"
}
