{
  "id": "a1b2c3d4-0007-4000-8000-000000000007",
  "organization_id": "a1b2c3d4-0000-4000-8000-000000000000",
  "name": "Minimal Revocation Profile",
  "status": "ACTIVE",
  "revocation_mechanism": ["BITSTRING_STATUS_LIST"],
  "check_mode": "CACHED",
  "cache_ttl_seconds": 300,
  "status_list_url": "https://credentials.example.com/status/1",
  "created_at": "2026-03-11T00:00:00Z"
}
